{
  "$schema": "./emotions.schema.json",
  "version": "2026-10-03",
  "generatedBy": "tools/seed-to-json.js",
  "presets": {
    "steady": {
      "poolMs": [
        9000,
        16000
      ],
      "blinkMs": [
        6000,
        14000
      ],
      "breathe": 0.01
    },
    "calm": {
      "poolMs": [
        7000,
        12000
      ],
      "blinkMs": [
        5000,
        11000
      ],
      "breathe": 0.01
    },
    "slow": {
      "poolMs": [
        12000,
        20000
      ],
      "blinkMs": [
        8000,
        16000
      ],
      "breathe": 0.006,
      "blinkS": "heavy"
    },
    "lively": {
      "poolMs": [
        2500,
        4500
      ],
      "blinkMs": [
        2500,
        5000
      ],
      "breathe": 0.014,
      "antics": true
    },
    "jumpy": {
      "poolMs": [
        1400,
        2600
      ],
      "blinkMs": [
        1600,
        3500
      ],
      "breathe": 0.008,
      "poolSpeed": 9
    },
    "nervous": {
      "poolMs": [
        900,
        1800
      ],
      "blinkMs": [
        1200,
        2600
      ],
      "breathe": 0.006,
      "blinkS": "nervous"
    },
    "focused": {
      "poolMs": [
        1800,
        3200
      ],
      "blinkMs": [
        2800,
        5500
      ],
      "breathe": 0.004
    },
    "sleepy": {
      "poolMs": [
        4000,
        8000
      ],
      "blinkMs": null,
      "breathe": 0.005,
      "blinkS": "heavy"
    },
    "thinking": {
      "poolMs": [
        2000,
        3600
      ],
      "blinkMs": [
        3500,
        7000
      ],
      "breathe": 0.01,
      "blinkS": "thinking"
    }
  },
  "emotions": [
    {
      "id": "00",
      "name": "Dormir",
      "group": "life",
      "desc": "Ojos cerrados en líneas finas, zzz asciende lentamente en la esquina superior derecha, la cabeza ladeada, solo respira despacio",
      "en": {
        "name": "Sleeping",
        "desc": "Eyes closed to thin lines, zzz drifting up at the top right, only a slow breath remains"
      },
      "transition": 900,
      "gaze": false,
      "pool": [
        "closed",
        "closed2",
        "sleepy"
      ],
      "poolMs": [
        6000,
        10000
      ],
      "blinkMs": null,
      "openness": 0.08,
      "mouth": "flat",
      "body": {
        "y": 4,
        "rotate": -2,
        "breathe": 0.018,
        "color": "@dim",
        "zzz": 1
      },
      "eyes": {
        "both": {
          "y": 4,
          "lookY": 2
        }
      },
      "anims": [
        {
          "target": "eyes",
          "prop": "y",
          "type": "sine",
          "amp": 1.2,
          "period": 3600
        }
      ]
    },
    {
      "id": "01",
      "name": "Despertar",
      "group": "life",
      "desc": "Ojos cerrados se abren lentamente, un par de destellos entrecerrados como ruborizado, luego pasa a estar inactivo",
      "en": {
        "name": "Waking",
        "desc": "Eyes slowly crack open with a couple of groggy blinks, then settles into idle"
      },
      "transition": 320,
      "pool": [
        "closed"
      ],
      "poolMs": [
        800,
        800
      ],
      "blinkMs": null,
      "mouth": "o",
      "sequence": {
        "settle": {
          "next": "02"
        },
        "frames": [
          {
            "at": 0,
            "eyes": {
              "both": {
                "open": 0.1,
                "y": 4
              }
            }
          },
          {
            "at": 420,
            "eyes": {
              "left": {
                "open": 0.55,
                "y": 2
              },
              "right": {
                "open": 0.12,
                "y": 4
              }
            }
          },
          {
            "at": 820,
            "eyes": {
              "both": {
                "open": 0.3,
                "y": 3
              }
            }
          },
          {
            "at": 1400,
            "eyes": {
              "both": {
                "open": 1,
                "scaleX": 1.12,
                "scaleY": 1.12,
                "y": -2
              }
            }
          },
          {
            "at": 2100,
            "eyes": {
              "both": {
                "open": 1,
                "y": 0
              }
            }
          }
        ]
      }
    },
    {
      "id": "02",
      "name": "Inactivo",
      "group": "life",
      "desc": "Mira a la izquierda y a la derecha, la mirada se detiene en cada lado; ocasionalmente gira o rebota",
      "en": {
        "name": "Idle",
        "desc": "Glances left, glances right, lingering on each side; an occasional spin or bounce"
      },
      "transition": 700,
      "pool": [
        "calm",
        "calm2"
      ],
      "poolMs": [
        9000,
        16000
      ],
      "blinkMs": [
        6000,
        14000
      ],
      "antics": true,
      "mouth": "smile",
      "body": {
        "breathe": 0.012
      },
      "anims": [
        {
          "target": "eyes",
          "prop": "lookX",
          "type": "glance",
          "amp": 10,
          "period": 4800
        },
        {
          "target": "eyes",
          "prop": "lookY",
          "type": "sine",
          "amp": 2,
          "period": 4100,
          "phase": 1.1
        }
      ]
    },
    {
      "id": "03",
      "name": "Curioso",
      "group": "life",
      "desc": "Ojos muy abiertos / calmados / de escaneo giran rápidamente, cabeza inclinada, boca con pequeña o",
      "en": {
        "name": "Curious",
        "desc": "Wide, calm and scanning eye shapes rotate quickly, head tilted, mouth a small o"
      },
      "transition": 420,
      "pool": [
        "wide",
        "wide2",
        "calm",
        "scan"
      ],
      "poolMs": [
        1800,
        3200
      ],
      "blinkMs": [
        2500,
        5500
      ],
      "mouth": "o",
      "body": {
        "rotate": 4,
        "breathe": 0.01
      },
      "eyes": {
        "both": {
          "lookY": -1
        }
      },
      "anims": [
        {
          "target": "eyes",
          "prop": "lookX",
          "type": "sine",
          "amp": 2.4,
          "period": 2800
        }
      ]
    },
    {
      "id": "04",
      "name": "Distraído",
      "group": "life",
      "desc": "Ojos semicerrados giran lentamente, cada uno mirando en dirección opuesta, boca un punto pequeño; de vez en cuando hace un rebote",
      "en": {
        "name": "Spacing Out",
        "desc": "Half-closed eyes rotate slowly, each wandering its own way, mouth a tiny dot; a bounce now and then"
      },
      "transition": 800,
      "pool": [
        "sleepy",
        "closed2",
        "calm"
      ],
      "poolMs": [
        3500,
        6000
      ],
      "blinkMs": [
        4000,
        8000
      ],
      "antics": true,
      "mouth": "dot",
      "body": {
        "rotate": -3,
        "breathe": 0.008
      },
      "eyes": {
        "left": {
          "lookX": -4,
          "lookY": 2
        },
        "right": {
          "lookX": 5,
          "lookY": -1
        }
      },
      "anims": [
        {
          "target": "eyes",
          "prop": "lookX",
          "type": "sine",
          "amp": 3,
          "period": 6800
        }
      ]
    },
    {
      "id": "05",
      "name": "Iniciando",
      "group": "life",
      "desc": "Los ojos se iluminan alternadamente y lentamente, como un sistema inicializando paso a paso",
      "en": {
        "name": "Booting",
        "desc": "Eyes light up in slow alternation, like a system initializing step by step"
      },
      "transition": 480,
      "pool": [
        "calm",
        "calm2"
      ],
      "poolMs": [
        6000,
        10000
      ],
      "blinkMs": null,
      "mouth": "flat",
      "anims": [
        {
          "target": "left",
          "prop": "open",
          "type": "blink",
          "interval": 1600,
          "dur": 700
        },
        {
          "target": "right",
          "prop": "open",
          "type": "blink",
          "interval": 1600,
          "dur": 700,
          "phaseMs": 800
        },
        {
          "target": "eyes",
          "prop": "scale",
          "type": "pulse",
          "amp": 0.04,
          "period": 1600
        }
      ]
    },
    {
      "id": "06",
      "name": "Dormido",
      "group": "life",
      "desc": "Ojos somnolientos a medio cerrar, casi inmóviles, solo el leve más breve de la respiración",
      "en": {
        "name": "Dormant",
        "desc": "Drowsy eyes at half openness, nearly still, only the faintest breathing"
      },
      "transition": 1200,
      "gaze": false,
      "pool": [
        "sleepy",
        "closed2",
        "closed"
      ],
      "poolMs": [
        4000,
        8000
      ],
      "blinkMs": null,
      "openness": 0.4,
      "mouth": "flat",
      "body": {
        "y": 6,
        "scale": 0.98,
        "rotate": -1,
        "breathe": 0.005,
        "color": "@dim"
      },
      "eyes": {
        "both": {
          "y": 5
        }
      }
    },
    {
      "id": "07",
      "name": "Sacudida",
      "group": "life",
      "desc": "El cuerpo tiembla ligeramente, los ojos cerrados se abren entrecortados y entonces pasa a estar inactivo",
      "en": {
        "name": "Shake Awake",
        "desc": "The whole body trembles as the eyes stagger open, then settles into idle"
      },
      "transition": 220,
      "pool": [
        "closed"
      ],
      "poolMs": [
        800,
        800
      ],
      "blinkMs": null,
      "mouth": "o",
      "body": {
        "breathe": 0.004
      },
      "anims": [
        {
          "target": "body",
          "prop": "x",
          "type": "jitter",
          "amp": 4.5,
          "speed": 10,
          "decay": 1600
        },
        {
          "target": "body",
          "prop": "rotate",
          "type": "jitter",
          "amp": 3,
          "speed": 8,
          "decay": 1600